[
  {
    "Account_ShortName": "9999999999900001",
    "Account_Name": "CUENTA PRUEBA 01",
    "ChartOfAccount_Id": "RD_UNICA",
    "AccountType": "B",
    "ValuationType": "N",
    "InputMode": "C"
  },
  {
    "Account_ShortName": "9999999999900002",
    "Account_Name": "CUENTA PRUEBA 02",
    "ChartOfAccount_Id": "RD_UNICA",
    "AccountType": "B",
    "ValuationType": "N",
    "InputMode": "C"
  },
  {
    "Account_ShortName": "9999999999900003",
    "Account_Name": "CUENTA PRUEBA 03",
    "ChartOfAccount_Id": "RD_UNICA",
    "AccountType": "B",
    "ValuationType": "N",
    "InputMode": "C"
  },
  {
    "Account_ShortName": "9999999999900004",
    "Account_Name": "CUENTA PRUEBA 04",
    "ChartOfAccount_Id": "RD_UNICA",
    "AccountType": "B",
    "ValuationType": "N",
    "InputMode": "C"
  },
  {
    "Account_ShortName": "9999999999900005",
    "Account_Name": "CUENTA PRUEBA 05",
    "ChartOfAccount_Id": "RD_UNICA",
    "AccountType": "B",
    "ValuationType": "N",
    "InputMode": "C"
  },
  {
    "Account_ShortName": "9999999999900006",
    "Account_Name": "CUENTA PRUEBA 06",
    "ChartOfAccount_Id": "RD_UNICA",
    "AccountType": "B",
    "ValuationType": "N",
    "InputMode": "C"
  },
  {
    "Account_ShortName": "9999999999900007",
    "Account_Name": "CUENTA PRUEBA 07",
    "ChartOfAccount_Id": "RD_UNICA",
    "AccountType": "B",
    "ValuationType": "N",
    "InputMode": "C"
  },
  {
    "Account_ShortName": "9999999999900008",
    "Account_Name": "CUENTA PRUEBA 08",
    "ChartOfAccount_Id": "RD_UNICA",
    "AccountType": "B",
    "ValuationType": "N",
    "InputMode": "C"
  },
  {
    "Account_ShortName": "9999999999900009",
    "Account_Name": "CUENTA PRUEBA 09",
    "ChartOfAccount_Id": "RD_UNICA",
    "AccountType": "B",
    "ValuationType": "N",
    "InputMode": "C"
  },
  {
    "Account_ShortName": "9999999999900010",
    "Account_Name": "CUENTA PRUEBA 10",
    "ChartOfAccount_Id": "RD_UNICA",
    "AccountType": "B",
    "ValuationType": "N",
    "InputMode": "C"
  },
  {
    "Account_ShortName": "9999999999900011",
    "Account_Name": "CUENTA PRUEBA 11",
    "ChartOfAccount_Id": "RD_UNICA",
    "AccountType": "B",
    "ValuationType": "N",
    "InputMode": "C"
  }
]